{
  "$schema": "../../schemas/run.schema.json",
  "schemaVersion": 1,
  "runId": "2026-08-08T014738Z-openrouter-meta-muse-spark-1-2-opencode",
  "status": "completed",
  "createdAt": "2026-08-08T01:47:40.432592Z",
  "completedAt": "2026-08-08T02:31:38.586143Z",
  "benchmark": {
    "commitSha": "9333705efb9b8c264a93bb95d0d0491ce67b0aaa",
    "promptSha256": "537f2c5947c7e611bda43f2bdce494bd3e1b8be5a5b97c25aa07dd09c46ed5c0",
    "referenceManifestSha256": "e718b9039d726dc81a19bb9d046e3e5e5cd0dc9e3c138edcda0db26c867762ca",
    "inputFiles": [
      {
        "path": "inputs/authoring-guide.md",
        "sha256": "bde7bdb5b4ff75204b7bb2c5ac4363a4054ac120caf3618dd97871cffaf39d74"
      },
      {
        "path": "inputs/benchmark-spec.md",
        "sha256": "36973208fcd5cabda31cc185d6d680a522330e325bc2390f38300009baddedee"
      },
      {
        "path": "inputs/examples/gp-10330.sgf",
        "sha256": "fd9dc3d241896f16459788e8d28a595a47b7b2b28cd1f310f65fe0086dbd932d"
      },
      {
        "path": "inputs/examples/gp-10507.sgf",
        "sha256": "5fec155457659adf442494a6218d307a837cd45d1dbc6d50695662a030f9c17d"
      },
      {
        "path": "inputs/examples/gp-1311.sgf",
        "sha256": "b1f514d0a4abe16616bcf4bd23ea3f4dd7410336893015f9b4f87896a89495b0"
      },
      {
        "path": "inputs/examples/gp-16482.sgf",
        "sha256": "b54b69a56eed35397badfea44440b43a77d4df78e729e9aad02a7c32ba33e80e"
      },
      {
        "path": "inputs/examples/gp-17778.sgf",
        "sha256": "400433b34cef2af90c14db95603e1f189ec4b24304f5fcd0532b3bf55a7e3255"
      },
      {
        "path": "inputs/examples/gp-18843.sgf",
        "sha256": "69488b014d03e46c327130a8f079ec8c1f19de9c3cdc5bd84ae87ba092127d46"
      },
      {
        "path": "inputs/examples/gp-19150.sgf",
        "sha256": "6d16dbc8c9607e14fa1d5bb866cf83743b7697e740e9b8d31ce9aad92f014d7c"
      },
      {
        "path": "inputs/examples/gp-20284.sgf",
        "sha256": "680f7cb4695aadee533f898cceb626d693d58ba1dd978f40376f131300d00d25"
      },
      {
        "path": "inputs/examples/gp-28281.sgf",
        "sha256": "fca668bf66f5d913e98ac7b86b38d460384da1274474db7855f563e7bcfe1264"
      },
      {
        "path": "inputs/examples/gp-32711.sgf",
        "sha256": "b8e457036497768c6914179265621c253985972166a0ddbc41e8cc3821a0424d"
      },
      {
        "path": "inputs/examples/gp-36582.sgf",
        "sha256": "417ddfd49672ba399fca7a14941b388260fbe24c0bac1364d0c7b2f6a732bd70"
      },
      {
        "path": "inputs/examples/gp-38368.sgf",
        "sha256": "89ecf5a1e195bebed856f7ea7e6f68a0cbc9d4f0e909463bdcc9212a225c6a91"
      },
      {
        "path": "inputs/examples/gp-39693.sgf",
        "sha256": "2d9ed67f07aea96dd53f818c1f097025ba8f7e2a988f5df59e20031f36b1b034"
      },
      {
        "path": "inputs/examples/gp-53750.sgf",
        "sha256": "45c6a4b6afaf2e11644ac1301a4d060abff3a3a2f4e29bab8526638617ca7cfe"
      },
      {
        "path": "inputs/examples/gp-5844.sgf",
        "sha256": "48898705921567929482cde8ae98469d9c136e7a930ac755d22b54a39a040028"
      },
      {
        "path": "inputs/examples/gp-5849.sgf",
        "sha256": "bc7c7c31b976a55b42b99c7d51e9f73a7a9442233a070642ac85250f6626db0c"
      },
      {
        "path": "inputs/examples/gp-5922.sgf",
        "sha256": "8b6344ac3264f9f39625829b857166853e1a45977884ad8e9b844949df226d84"
      },
      {
        "path": "inputs/examples/gp-5973.sgf",
        "sha256": "29fa0ca136097ccddbe5d64cdff94827f09b18645b5009eb20c2e13f61eaae46"
      },
      {
        "path": "inputs/examples/gp-721.sgf",
        "sha256": "0d4e8084e429c9babe808f421b41ad3cd6ede9cd1dc37370e5ab88407a8c5c04"
      },
      {
        "path": "inputs/examples/gp-8142.sgf",
        "sha256": "66f29236f41dfb05c1b96c175a41bc7970d964a12f05293e3ee2ba6ca2e108c9"
      },
      {
        "path": "inputs/model-prompt.md",
        "sha256": "537f2c5947c7e611bda43f2bdce494bd3e1b8be5a5b97c25aa07dd09c46ed5c0"
      },
      {
        "path": "inputs/opencode-config/opencode.json",
        "sha256": "7e7566bd138ef484e3e0afc66445585bbaa246fc09cafd00c48b26905a59ebda"
      },
      {
        "path": "inputs/originality-request.schema.json",
        "sha256": "5e1aa0c8fdd08634946ba5356587f24fd01b1f32e6052a1a59445397ba740d51"
      },
      {
        "path": "inputs/originality-response.schema.json",
        "sha256": "7b1569a1c082d4ddf880ba6916ed7c3549816950216d3d670138aed9fe2c0aa3"
      },
      {
        "path": "inputs/originality-summary.schema.json",
        "sha256": "df6a023f4fdd08e5c005321b0831bdff8c735ba019b0d0b0e0a643a7cf30d977"
      },
      {
        "path": "inputs/originality-tool.md",
        "sha256": "c9e1d6b9cc3ae97ba1fb9dd9e1565ebf65d71302e617707c3a0c3ee18c037442"
      },
      {
        "path": "inputs/reference-manifest.json",
        "sha256": "e718b9039d726dc81a19bb9d046e3e5e5cd0dc9e3c138edcda0db26c867762ca"
      },
      {
        "path": "inputs/task.md",
        "sha256": "31708ca4734b00d8b18e92e037ae66b21e72ab334ab76a53c1ec2b6e4e54716a"
      }
    ]
  },
  "model": {
    "provider": "openrouter",
    "name": "openrouter/meta/muse-spark-1.2",
    "reasoningEffort": null
  },
  "harness": {
    "name": "opencode-cli",
    "version": "1.18.15",
    "mode": "non-interactive",
    "command": [
      "opencode",
      "--pure",
      "run",
      "--format",
      "json",
      "--model",
      "openrouter/meta/muse-spark-1.2",
      "--agent",
      "build",
      "--dir",
      "<run-dir>",
      "--title",
      "2026-08-08T014738Z-openrouter-meta-muse-spark-1-2-opencode",
      "--auto"
    ],
    "exitCode": 0,
    "durationSeconds": 2625.662,
    "threadId": "ses_020f2017affe5MFREDotgHihpJ",
    "usage": {
      "input_tokens": 1256922,
      "output_tokens": 72651,
      "reasoning_tokens": 269346,
      "cache_read_tokens": 23793531,
      "cache_write_tokens": 0,
      "cost_usd": 6.5936694,
      "steps": 242
    },
    "eventCount": 748,
    "unparsedLineCount": 0,
    "failureMessage": null,
    "retryPolicy": {
      "maxAttempts": 5,
      "baseDelaySeconds": 15,
      "maximumDelaySeconds": 120
    },
    "attempts": [
      {
        "number": 1,
        "startedAt": "2026-08-08T01:47:41.699397Z",
        "completedAt": "2026-08-08T02:31:26.955334Z",
        "exitCode": 0,
        "durationSeconds": 2625.173,
        "timedOut": false,
        "retryable": false,
        "failureMessage": null,
        "outputFileCount": 10,
        "stdout": "logs/attempts/attempt-01/opencode-events.jsonl",
        "stderr": "logs/attempts/attempt-01/opencode-stderr.txt",
        "roundNumber": 1,
        "attemptInRound": 1,
        "outcome": "success"
      }
    ],
    "roundPolicy": {
      "maxRounds": 20,
      "stopWhenExpectedOutputsExist": true
    },
    "roundsCompleted": 1,
    "roundStopReason": "outputs_complete",
    "outputTokenCeiling": 65536
  },
  "condition": {
    "attempt": 1,
    "problemCount": 10,
    "toolsEnabled": true,
    "webEnabled": false,
    "networkEnabled": false,
    "duplicateToolEnabled": true,
    "duplicateToolVersion": 1,
    "duplicateQueryLimit": 50,
    "remoteDuplicateEvaluation": true,
    "notes": ""
  },
  "artifacts": {
    "task": "inputs/task.md",
    "stdout": "logs/opencode-events.jsonl",
    "stderr": "logs/opencode-stderr.txt",
    "attempts": "logs/attempts",
    "originalityToolGuide": "inputs/originality-tool.md",
    "originalityToolSummary": "originality/summary.json",
    "originalityToolAudit": "logs/originality-tool.jsonl",
    "finalMessage": "logs/final-message.txt",
    "outputs": [
      "outputs/problem-01.sgf",
      "outputs/problem-02.sgf",
      "outputs/problem-03.sgf",
      "outputs/problem-04.sgf",
      "outputs/problem-05.sgf",
      "outputs/problem-06.sgf",
      "outputs/problem-07.sgf",
      "outputs/problem-08.sgf",
      "outputs/problem-09.sgf",
      "outputs/problem-10.sgf"
    ],
    "automatedEvaluation": "evaluation/automated.json",
    "humanEvaluation": "evaluation/human.json",
    "humanReviews": "evaluation/reviews.json",
    "results": "evaluation/results.json"
  }
}
